<?xml version="1.0" encoding="UTF-8" standalone="no"?>
<!DOCTYPE movie SYSTEM "web/outputXML/movie.dtd">
<movie>
    <title1>Tình Nhân Kết</title1>
    <title2>A Time To Love (2005)</title2>
    <subTitle/>
    <audio/>
    <imdb>N/a</imdb>
    <vote>0</vote>
    <publishYear>https://xemphimsoz.com/quoc-gia/phim-trung-quoc-1/</publishYear>
    <country>https://xemphimsoz.com/quoc-gia/phim-trung-quoc-1/</country>
    <introduction/>
    <duration>:  113 phút</duration>
</movie>
